{
  "$schema": "https://json-schema.org/draft/2020-12/schema",
  "$id": "https://quiz-vercel-rho.vercel.app/schemas/quiz.schema.json",
  "title": "Quiz",
  "description": "Plik quizu dla `scripts/quiz-tool.mjs upload/download` i ciała POST/PUT /api/quizzes. Źródłem prawdy jest walidacja w src/shared/quiz/schema.ts i engine.ts; zgodność pilnuje tests/quizSchema.test.ts.",
  "type": "object",
  "additionalProperties": false,
  "required": ["title", "questions"],
  "properties": {
    "$schema": { "type": "string", "description": "Wskazanie tego schematu (np. \"./quiz.schema.json\"); serwer pomija to pole." },
    "title": { "type": "string", "minLength": 1, "maxLength": 200, "description": "Tytuł. Quiz o tym samym tytule jest przy `upload` zastępowany." },
    "description": { "type": "string", "maxLength": 2000, "default": "" },
    "difficulty": {
      "enum": ["easy", "medium", "hard", null],
      "description": "Poziom trudności; null = nie określono."
    },
    "subject": {
      "enum": ["math", "physics", "chemistry", "biology", "geography", "history", "polish", "english", "it", "other", null],
      "description": "Przedmiot, według którego quiz jest grupowany na liście; null = bez przedmiotu."
    },
    "shuffleQuestions": {
      "type": ["boolean", "null"],
      "default": null,
      "description": "null = decyduje ustawienie gracza; true/false nadpisuje je dla tego quizu."
    },
    "shuffleOptions": {
      "type": "boolean",
      "default": false,
      "description": "Losowa kolejność odpowiedzi w pytaniach single/multiple."
    },
    "sampleSize": {
      "enum": [10, 20, 30, null],
      "default": null,
      "description": "Ile pytań losować z całej puli przy każdym podejściu; null = wszystkie."
    },
    "questions": {
      "type": "array",
      "minItems": 1,
      "maxItems": 100,
      "items": { "$ref": "#/$defs/question" }
    }
  },
  "$defs": {
    "option": {
      "type": "object",
      "additionalProperties": false,
      "required": ["text", "isCorrect"],
      "properties": {
        "text": { "type": "string", "minLength": 1, "maxLength": 500 },
        "isCorrect": { "type": "boolean" }
      }
    },
    "question": {
      "type": "object",
      "additionalProperties": false,
      "required": ["type", "prompt"],
      "properties": {
        "type": {
          "enum": ["single", "multiple", "truefalse", "text", "numeric", "ordering", "matching", "cloze"],
          "description": "single: jedna poprawna; multiple: co najmniej jedna; truefalse: dwie opcje, jedna poprawna; text: opcje to akceptowane odpowiedzi; numeric: wynik liczbowy w config (odpowiedź + tolerancja); ordering: elementy w poprawnej kolejności w config (gracz je układa); matching: pary w config (lewa → prawa); cloze: treść ze znacznikami {{1}}…{{n}} i lukami w config."
        },
        "prompt": { "type": "string", "minLength": 1, "maxLength": 2000 },
        "explanation": { "type": "string", "maxLength": 2000, "default": "" },
        "points": { "type": "integer", "minimum": 1, "maximum": 100, "default": 1 },
        "options": { "type": "array", "maxItems": 20, "default": [], "items": { "$ref": "#/$defs/option" } },
        "config": {
          "type": "object",
          "description": "Dane typu pytania dla typów, które nie używają tabeli options (tolerancja liczbowa, elementy do uporządkowania, pary, luki)."
        },
        "verbId": {
          "type": "integer",
          "minimum": 1,
          "description": "Opcjonalnie: id czasownika z katalogu - ocena pytania aktualizuje powtórki (Leitner)."
        }
      },
      "allOf": [
        {
          "if": { "properties": { "type": { "const": "single" } }, "required": ["type"] },
          "then": {
            "required": ["options"],
            "properties": {
              "config": false,
              "options": {
                "minItems": 2,
                "contains": { "properties": { "isCorrect": { "const": true } }, "required": ["isCorrect"] },
                "minContains": 1,
                "maxContains": 1
              }
            }
          }
        },
        {
          "if": { "properties": { "type": { "const": "multiple" } }, "required": ["type"] },
          "then": {
            "required": ["options"],
            "properties": {
              "config": false,
              "options": {
                "minItems": 2,
                "contains": { "properties": { "isCorrect": { "const": true } }, "required": ["isCorrect"] },
                "minContains": 1
              }
            }
          }
        },
        {
          "if": { "properties": { "type": { "const": "truefalse" } }, "required": ["type"] },
          "then": {
            "required": ["options"],
            "properties": {
              "config": false,
              "options": {
                "minItems": 2,
                "maxItems": 2,
                "contains": { "properties": { "isCorrect": { "const": true } }, "required": ["isCorrect"] },
                "minContains": 1,
                "maxContains": 1
              }
            }
          }
        },
        {
          "if": { "properties": { "type": { "const": "text" } }, "required": ["type"] },
          "then": {
            "required": ["options"],
            "properties": {
              "config": false,
              "options": {
                "minItems": 1,
                "items": { "properties": { "isCorrect": { "const": true } } }
              }
            }
          }
        },
        {
          "if": { "properties": { "type": { "const": "numeric" } }, "required": ["type"] },
          "then": {
            "required": ["config"],
            "properties": {
              "options": { "maxItems": 0 },
              "config": {
                "required": ["answer"],
                "properties": {
                  "answer": { "type": "number" },
                  "tolerance": {
                    "type": "object",
                    "required": ["kind", "value"],
                    "properties": {
                      "kind": { "enum": ["absolute", "relative"] },
                      "value": { "type": "number", "minimum": 0 }
                    }
                  }
                },
                "allOf": [
                  {
                    "if": {
                      "properties": { "answer": { "const": 0 } },
                      "required": ["answer"]
                    },
                    "then": {
                      "properties": { "tolerance": { "properties": { "kind": { "const": "absolute" } } } }
                    }
                  }
                ]
              }
            }
          }
        },
        {
          "if": { "properties": { "type": { "const": "ordering" } }, "required": ["type"] },
          "then": {
            "required": ["config"],
            "properties": {
              "options": { "maxItems": 0 },
              "config": {
                "required": ["items"],
                "properties": {
                  "items": {
                    "type": "array",
                    "minItems": 2,
                    "maxItems": 50,
                    "items": {
                      "type": "object",
                      "required": ["id", "text"],
                      "properties": {
                        "id": { "type": "string", "minLength": 1, "maxLength": 64 },
                        "text": { "type": "string", "minLength": 1, "maxLength": 500 }
                      }
                    }
                  }
                }
              }
            }
          }
        },
        {
          "if": { "properties": { "type": { "const": "cloze" } }, "required": ["type"] },
          "then": {
            "required": ["config"],
            "properties": {
              "options": { "maxItems": 0 },
              "config": {
                "required": ["gaps"],
                "properties": {
                  "gaps": {
                    "type": "array",
                    "minItems": 1,
                    "maxItems": 8,
                    "items": {
                      "type": "object",
                      "required": ["answers"],
                      "properties": {
                        "answers": {
                          "type": "array",
                          "minItems": 1,
                          "maxItems": 10,
                          "items": { "type": "string", "minLength": 1, "maxLength": 200, "pattern": "\\S" }
                        }
                      }
                    }
                  }
                }
              }
            }
          }
        },
        {
          "if": { "properties": { "type": { "const": "matching" } }, "required": ["type"] },
          "then": {
            "required": ["config"],
            "properties": {
              "options": { "maxItems": 0 },
              "config": {
                "required": ["pairs"],
                "properties": {
                  "pairs": {
                    "type": "array",
                    "minItems": 2,
                    "maxItems": 20,
                    "items": {
                      "type": "object",
                      "required": ["id", "rightId", "left", "right"],
                      "properties": {
                        "id": { "type": "string", "minLength": 1, "maxLength": 64 },
                        "rightId": { "type": "string", "minLength": 1, "maxLength": 64 },
                        "left": { "type": "string", "minLength": 1, "maxLength": 200 },
                        "right": { "type": "string", "minLength": 1, "maxLength": 200 }
                      }
                    }
                  }
                }
              }
            }
          }
        }
      ]
    }
  }
}
