{
  "title": "Czasowniki nieregularne – wybór 1 z 4 (lista)",
  "description": "Wszystkie 50 czasowników z listy: po polsku → wybierz poprawne trzy formy (bezokolicznik, past simple, past participle) spośród czterech.",
  "difficulty": "medium",
  "shuffleQuestions": true,
  "shuffleOptions": true,
  "sampleSize": null,
  "questions": [
    {
      "type": "single",
      "prompt": "Wybierz poprawne trzy formy czasownika: Wiać",
      "explanation": "blow – blew – blown",
      "points": 1,
      "options": [
        {
          "text": "blow – blew – blown",
          "isCorrect": true
        },
        {
          "text": "blow – blowed – blowed",
          "isCorrect": false
        },
        {
          "text": "blow – blown – blew",
          "isCorrect": false
        },
        {
          "text": "blow – blew – withdrawn",
          "isCorrect": false
        }
      ]
    },
    {
      "type": "single",
      "prompt": "Wybierz poprawne trzy formy czasownika: Uciekać",
      "explanation": "flee – fled – fled",
      "points": 1,
      "options": [
        {
          "text": "flee – fled – fled",
          "isCorrect": true
        },
        {
          "text": "flee – fleed – fleed",
          "isCorrect": false
        },
        {
          "text": "flee – fled – ridden",
          "isCorrect": false
        },
        {
          "text": "flee – threw – swept",
          "isCorrect": false
        }
      ]
    },
    {
      "type": "single",
      "prompt": "Wybierz poprawne trzy formy czasownika: Hodować",
      "explanation": "breed – bred – bred",
      "points": 1,
      "options": [
        {
          "text": "breed – bred – bred",
          "isCorrect": true
        },
        {
          "text": "breed – breeded – breeded",
          "isCorrect": false
        },
        {
          "text": "breed – bred – rung",
          "isCorrect": false
        },
        {
          "text": "breed – spent – swept",
          "isCorrect": false
        }
      ]
    },
    {
      "type": "single",
      "prompt": "Wybierz poprawne trzy formy czasownika: Radzić sobie",
      "explanation": "deal – dealt – dealt",
      "points": 1,
      "options": [
        {
          "text": "deal – dealt – dealt",
          "isCorrect": true
        },
        {
          "text": "deal – dealed – dealed",
          "isCorrect": false
        },
        {
          "text": "deal – dealt – thrown",
          "isCorrect": false
        },
        {
          "text": "deal – wore – blown",
          "isCorrect": false
        }
      ]
    },
    {
      "type": "single",
      "prompt": "Wybierz poprawne trzy formy czasownika: Skakać",
      "explanation": "leap – leapt – leapt",
      "points": 1,
      "options": [
        {
          "text": "leap – leapt – leapt",
          "isCorrect": true
        },
        {
          "text": "leap – leaped – leaped",
          "isCorrect": false
        },
        {
          "text": "leap – leapt – leant",
          "isCorrect": false
        },
        {
          "text": "leap – showed – seen",
          "isCorrect": false
        }
      ]
    },
    {
      "type": "single",
      "prompt": "Wybierz poprawne trzy formy czasownika: Leżeć",
      "explanation": "lie – lay – lain",
      "points": 1,
      "options": [
        {
          "text": "lie – lay – lain",
          "isCorrect": true
        },
        {
          "text": "lie – lied – lied",
          "isCorrect": false
        },
        {
          "text": "lie – lain – lay",
          "isCorrect": false
        },
        {
          "text": "lie – lay – lost",
          "isCorrect": false
        }
      ]
    },
    {
      "type": "single",
      "prompt": "Wybierz poprawne trzy formy czasownika: Szukać",
      "explanation": "seek – sought – sought",
      "points": 1,
      "options": [
        {
          "text": "seek – sought – sought",
          "isCorrect": true
        },
        {
          "text": "seek – seeked – seeked",
          "isCorrect": false
        },
        {
          "text": "seek – sought – wound",
          "isCorrect": false
        },
        {
          "text": "seek – dealt – undergone",
          "isCorrect": false
        }
      ]
    },
    {
      "type": "single",
      "prompt": "Wybierz poprawne trzy formy czasownika: Zrzucać",
      "explanation": "shed – shed – shed",
      "points": 1,
      "options": [
        {
          "text": "shed – shed – shed",
          "isCorrect": true
        },
        {
          "text": "shed – sheded – sheded",
          "isCorrect": false
        },
        {
          "text": "shed – shed – withdrawn",
          "isCorrect": false
        },
        {
          "text": "shed – tore – shown",
          "isCorrect": false
        }
      ]
    },
    {
      "type": "single",
      "prompt": "Wybierz poprawne trzy formy czasownika: Drzeć",
      "explanation": "tear – tore – torn",
      "points": 1,
      "options": [
        {
          "text": "tear – tore – torn",
          "isCorrect": true
        },
        {
          "text": "tear – teared – teared",
          "isCorrect": false
        },
        {
          "text": "tear – torn – tore",
          "isCorrect": false
        },
        {
          "text": "tear – tore – thrust",
          "isCorrect": false
        }
      ]
    },
    {
      "type": "single",
      "prompt": "Wybierz poprawne trzy formy czasownika: Przysięgać",
      "explanation": "swear – swore – sworn",
      "points": 1,
      "options": [
        {
          "text": "swear – swore – sworn",
          "isCorrect": true
        },
        {
          "text": "swear – sweared – sweared",
          "isCorrect": false
        },
        {
          "text": "swear – sworn – swore",
          "isCorrect": false
        },
        {
          "text": "swear – swore – undergone",
          "isCorrect": false
        }
      ]
    },
    {
      "type": "single",
      "prompt": "Wybierz poprawne trzy formy czasownika: Puchnąć",
      "explanation": "swell – swelled – swollen",
      "points": 1,
      "options": [
        {
          "text": "swell – swelled – swollen",
          "isCorrect": true
        },
        {
          "text": "swell – swelled – swelled",
          "isCorrect": false
        },
        {
          "text": "swell – swollen – swelled",
          "isCorrect": false
        },
        {
          "text": "swell – swelled – sought",
          "isCorrect": false
        }
      ]
    },
    {
      "type": "single",
      "prompt": "Wybierz poprawne trzy formy czasownika: Wycofywać",
      "explanation": "withdraw – withdrew – withdrawn",
      "points": 1,
      "options": [
        {
          "text": "withdraw – withdrew – withdrawn",
          "isCorrect": true
        },
        {
          "text": "withdraw – withdrawed – withdrawed",
          "isCorrect": false
        },
        {
          "text": "withdraw – withdrawn – withdrew",
          "isCorrect": false
        },
        {
          "text": "withdraw – withdrew – run",
          "isCorrect": false
        }
      ]
    },
    {
      "type": "single",
      "prompt": "Wybierz poprawne trzy formy czasownika: Nawijać",
      "explanation": "wind – wound – wound",
      "points": 1,
      "options": [
        {
          "text": "wind – wound – wound",
          "isCorrect": true
        },
        {
          "text": "wind – winded – winded",
          "isCorrect": false
        },
        {
          "text": "wind – wound – worn",
          "isCorrect": false
        },
        {
          "text": "wind – saw – stuck",
          "isCorrect": false
        }
      ]
    },
    {
      "type": "single",
      "prompt": "Wybierz poprawne trzy formy czasownika: Zamiatać",
      "explanation": "sweep – swept – swept",
      "points": 1,
      "options": [
        {
          "text": "sweep – swept – swept",
          "isCorrect": true
        },
        {
          "text": "sweep – sweeped – sweeped",
          "isCorrect": false
        },
        {
          "text": "sweep – swept – taught",
          "isCorrect": false
        },
        {
          "text": "sweep – spent – left",
          "isCorrect": false
        }
      ]
    },
    {
      "type": "single",
      "prompt": "Wybierz poprawne trzy formy czasownika: Wyżymać",
      "explanation": "wring – wrung – wrung",
      "points": 1,
      "options": [
        {
          "text": "wring – wrung – wrung",
          "isCorrect": true
        },
        {
          "text": "wring – wringed – wringed",
          "isCorrect": false
        },
        {
          "text": "wring – wrung – swept",
          "isCorrect": false
        },
        {
          "text": "wring – meant – learnt",
          "isCorrect": false
        }
      ]
    },
    {
      "type": "single",
      "prompt": "Wybierz poprawne trzy formy czasownika: Nosić",
      "explanation": "wear – wore – worn",
      "points": 1,
      "options": [
        {
          "text": "wear – wore – worn",
          "isCorrect": true
        },
        {
          "text": "wear – weared – weared",
          "isCorrect": false
        },
        {
          "text": "wear – worn – wore",
          "isCorrect": false
        },
        {
          "text": "wear – wore – shown",
          "isCorrect": false
        }
      ]
    },
    {
      "type": "single",
      "prompt": "Wybierz poprawne trzy formy czasownika: Przechodzić",
      "explanation": "undergo – underwent – undergone",
      "points": 1,
      "options": [
        {
          "text": "undergo – underwent – undergone",
          "isCorrect": true
        },
        {
          "text": "undergo – undergoed – undergoed",
          "isCorrect": false
        },
        {
          "text": "undergo – undergone – underwent",
          "isCorrect": false
        },
        {
          "text": "undergo – underwent – left",
          "isCorrect": false